{
  "schema_version": "purchase_event.v1",
  "seller_id": "dh-store-990367",
  "source": "dunnhumby",
  "seller_partition": "simulated_independent_store",
  "customer_id_local": "dh-hh-990001",
  "basket_id_local": "dh-b-31198644013",
  "purchase_event_id": "9b811b383c45e3193fc3351158531ea3",
  "time": {
    "kind": "absolute",
    "value": "2017-03-14T19:22:00Z"
  },
  "order_rank": null,
  "items": [
    {
      "item_id_local": "dh-p-990000001",
      "quantity_observed": 1
    },
    {
      "item_id_local": "dh-p-9553755",
      "quantity_observed": 3
    }
  ]
}
