{
  "schema_version": "purchase_event.v1",
  "seller_id": "seller-a",
  "source": "live",
  "seller_partition": "platform_seller",
  "customer_id_local": "buyer-17",
  "basket_id_local": "order-001",
  "purchase_event_id": "3b0d50cbae46f6c2d792fc7c9765eb1b",
  "time": {
    "kind": "absolute",
    "value": "2026-09-22T03:05:00Z"
  },
  "order_rank": null,
  "items": [
    {
      "item_id_local": "item-42",
      "quantity_observed": 2
    }
  ]
}
