{
  "schema_version": "purchase_event.v1",
  "seller_id": "ic-client-990007",
  "source": "instacart",
  "seller_partition": "synthetic_partition",
  "customer_id_local": "ic-user-990001",
  "basket_id_local": "ic-o-9900001",
  "purchase_event_id": "922784d6fbfa211c50c622e862b13ba2",
  "time": {
    "kind": "relative_day",
    "value": 41.0
  },
  "order_rank": 7,
  "items": [
    {
      "item_id_local": "ic-p-990001",
      "quantity_observed": null
    },
    {
      "item_id_local": "ic-p-990002",
      "quantity_observed": null
    }
  ]
}
